{
  "header": {
    "format": "rosmarops-results",
    "version": 1,
    "kit_id": "0c747b2f915a594637acda95fe07427e",
    "key_id": "7c3504810421cb6c5225ff795cbb1283",
    "host_id": "host_d561f9348d799055",
    "created_at": "2026-10-31T12:00:00Z",
    "rosmarops_version": "0.6.0"
  },
  "wrapped_key": "Fj+zD8ZX1jH1IuHAddysAVIWUKK0ZLbfB3yhvwQeIOvCv/f58hGwImOBLDAlx1mShqYwwaQfifhMqm6h",
  "nonce": "MRWFtv38c4HNf2mB",
  "ciphertext": "+lXYZ/iy/TQYl9GXlIzK1oNT3ECimseeuFP/YFdElatzXh+N7NKTKLhe6QJXWssTDTyPjau0YMa05ViVc/+qGlAAeguJP12eyQ/9QxYMVdAJcXrlR1VpqzqG8OhVIgGFFTKlX6F6M6SJcrByjLxjGHsqKqBA2hbXNtbtmoJust+XsIDT0//4V8GXcyiN4qGefpTDBD6QdqvfmQLeu6kESiG0qu/cxLneyqnrWXlGZwoilFyANecRM3p5RstJrurrWio22DIgAWqTTeLcCD0bXAuRcmAxv46PNYbe8m+gni3SGoehT+hFYr3EmmGxrSAcm1fsvky1zfgOHoeRiPJ1qBKrpWfjvNxYqIaTg/5bmiYpgFAsN1k2eMC25ojtF2rod+XKvgizjfq5I9PgYaTD8pyAnTBBfDGSVsi6ksn6AN3fk4qm13SMMmxip0xdJUIODHNXwlOO4D5wlrYqpGm9nEMRRZB4P5jF7KmK/p5yG2kDogoI9Ba6zNoxlh3HIhNiN4uCcEUQOcD74hdmM6in8fnnZQ5JSaIZ/mxehrd1rTc6nAVe921qYMOzWLX8QHpBPsEZjdYgdFAG57/BOtg0rkzTv8YmyC8CWA7nvya+du71S/cn9vF3F6X28nUQ2FMgKHPrIy4LZXn/aHspdWcvAp5OfCky14NRZTpU52vKvd06FEIG/z9auERrey/2HTT3A8eOh6QfUk3W+PupzC/nJr2KzcTuwsN9jfItL0XMU62cLyHGERtK+meryYLetv0xvpVmAj4s20MmVYK2N3jfkVdzYQ9ZAN6BZZe/Yvfy9yjiMu/B+2z+skxHDzmgp/nuOgYUGQiP6gq47UC783L23sI+q3ViQOi5JMTPT/w7vVraJ+S58190CdLk9/ailNPPfnarcMpmwz9fBPiknvOmd2GY1EPHRn+G8wuhXnD4J3S3oN8NuYmqg4HotDy4CAso+DbrI65mIJiWflUe+BH4stC/7weeRXa9ctz0rN5yYdEhPH98IqtBf2rWfj/FLsg6KFt/gL79sN4IaAnRse0T2djSyEH7p5fFV0CfEL/gmeEFeaxGTbQJ0+QtS/hWea3YAukOWubgRvtGF6nn2RsEQucmQYdwybgkBpzPBBkhdC3Evi/UgafjAv2aw9F7r64Pb0LYDjAt1YqUHxB4tMEdU1NB+auT0e9FzRnxa51P5bnOrjHFT129Lulqb2xwHaqdP9hNA/1lPJ2TGzWKrkz7TtYBnpekKLaEvo0PinWnZVHCt48rDQH3qe9cSt/JHQ8GxaIlHovnc6ob/yQL66cS3yyAuwm4PsbWEyJmrbRxAvy2Iqjs/QiSPN1o3mYI1cNa00WhbZQ5NqaKn+tPvg/MDMrxUMnV/L1CRWFgN/Kb2aMZcwxu/8HiNkUHpenSwRC/nvO0jOWINWb+uYH6wfVcjTvT6GfwDU3QHnsxsa+J9z/FNA/pRPNS68Uo/+Dvunxdf/cZ0bf2mRAtwZbLmBKCBo/qwyVNJtF/2yV9hYWJW2LOIF8R/kNjOR/5ySvar7Vsyvww4l2iOjnS201APuPffl7vdyhjNUuie/Md4CX/BiAjwlacMyMDaazkGKTlKMG5aOSZozrFj7/YXIwPtC0kloK8vwElGO5Qw7EZzavpY6tdxdS7aiQf1mGZWxCgioid2FInbgVyTtYsCHAG+YdfwD6Ta098eXc4oXtGLojUTv7OtKaFvnFIlSv18Z3jaj+zHakO8+alcFcOW+HZdP1r07MDuef6yI9ea+AF7chfxHag4pLCpCyBdmq0RxLD7l1EzpAWp4czv3Neb8BGllV4xQBPvNTNeW/oDNNundJ51cQ8FPYKr+YA9mQ1nVHJmVYqijCdz7iqeoGv+mPhbyH+YaoDbOFlTiWIpjMzC93vyEAoZ5K6+/z2HjITGLU5+IR2EvalFdiCk1UGWPgdPr6WFtZeVKiLZ1j5NiKRMXHRqnEsEJTCpGg1lSLVwXqpx6iXZN7O6SGmqskmMQqzXv/b8bGDeW5UKW7BFPe/roS2+xzahYkEbhnGw37iOVO7iDyShwu4TI+sp0+wZUK8qGI9WqBpRz8noMXWk3+Z0RVC1Wnn7LO7lZIu1tCr3p0uUCos4w1K8U7aETA8zIJHlt0Ci0lhnFr/GA6nIU6fpiStJPIW7i53BJiFTh1wK9s9oW0239Ws1dWJA2fZktREMRs6GFTLi6aicV9c+XwpMn9w7OTbGO1PW4YJevQJFcnGyVXglLOMcAqDyh8w/rhHjtiPB39e1n1th8LbLCoWUi48SYkhIxf20wxh0/aQKIVE8I+FToafiS2iUZmZ0W+WmjFDKTeIUIlexgGuVcNNplBzXp6ylaeSpxLtl4VOeA/mv2Ap2eSXHJe/JhXUtWtVM+U2CHz87ZX2fVSxF7dWnPaGLNj2LWyra1m/0kqZ36oakH76mC1kfTRwZtUC2xfybMq4IlGQb4HW4vCWIDbaURXnGoW180Ki0V2H+tp+8/TXTrl+SCrOKitmAGlX2gOUeVV85HL7v7KM9s0XEfaZt4HXkzrYRc4nNfHQGD2/0CMTIOsqjeiKvzgIi0JQDTvccqRk1p9cBvV+1opa9vqCakWd5kka50f6vkyiyOTNXz83N3yLHlVIhUXvb7XGQCexJxiauDW5vmVS664D8Iq7KPPEZUuX5CZ+LbZRkpX5Mmg6UrcDH1pBqBoBIihN7aq0RvzcgsZgNGKEG8TCwu1o660NMFIphweHjZgX6vhHbgKx8YwgFhqS6wz7jnxragh4KU0EUpRDOtaME5WawR9YeGUHiK5QPz0BFcJnzRl11KE8Jq9DZlvOJIDVellslMYqrPb/uWTzIPsNQPTrYS4c9rzlrZXYqO3EPbbj5+ENqrM9OI0ETq3j8xbxPi1dtF7ap1lE89LfYK/5N69XSe96TKmBihI/413X2biuqsTkHmEex3WLXE460/w123b7X3BWkjSkmnRNWxJHTphkf/tKGVuSc2wVjUNMyrCQAQM9oLEXg+UBwkDRsDevuPuPrRNuAF2krCvZyMdNUafyeaOXC1gja5tSowJg3xDFhw20+BO9O+6YRzjgWR5unK/8AGNIs7EqC8BN3hLoe6kmVTqdodupFEmDPXSYuL/C4GhfDh7J19PeQcVEToIAv54V7pIosohj0adQc/7B3CmcKQYyd/MYO4SZ7NmaTaqJDHnyf+5kITjk0OY11F1awP0PHnhNM1prlUFGb28YEHSYcvuCtSmK0zpx8wIQem1K"
}